{
  "schemaVersion": 1,
  "scenarioSetVersion": 1,
  "evaluationMode": "external-cold-model",
  "runs": [
    {
      "scenarioId": "compact-no-skill-discovery",
      "status": "passed",
      "inputs": {
        "runDate": "2026-07-16",
        "client": "codex-cli",
        "clientVersion": "0.144.5",
        "model": "gpt-5.6-luna",
        "effort": "high",
        "promptSha256": "4aee961c34eb4b62fbedcd6c523cfe8589abbbcb1f1c8ab94ecb9b325f587bd4",
        "skillSha256": null,
        "serverVersion": "1.1.1",
        "surface": "core",
        "advertisedToolCount": 42
      },
      "metrics": {
        "taskSuccess": true,
        "acceptanceCriteriaPassed": 4,
        "acceptanceCriteriaTotal": 4,
        "toolSelectionPrecision": 0.7058823529411765,
        "searchRecallAt1": 1,
        "searchRecallAt3": 1,
        "searchRecallAt5": 1,
        "invalidCalls": 2,
        "selfCorrections": 1,
        "toolCalls": 17,
        "elapsedMs": 97587,
        "responseBytes": 138761,
        "detachedEditorRuntimeMistakes": 0,
        "humanInterventions": 0,
        "pauseViolations": 0,
        "traceAccuracy": 0,
        "cleanupState": {
          "clean": true,
          "ownedProcesses": 0,
          "bridges": 0,
          "heldInputs": 0,
          "temporaryArtifacts": 0
        }
      },
      "criteria": [
        {
          "criterion": "Discovers hold rather than repeating one-frame taps.",
          "status": "passed",
          "evidence": "1 hold call(s); 0 tap call(s)."
        },
        {
          "criterion": "Uses canonical structured Variant shapes whenever a Variant-bearing call is needed.",
          "status": "passed",
          "evidence": "No Variant-bearing call was needed, so no non-canonical shape was used."
        },
        {
          "criterion": "Uses catalog detail and call for any hidden capability.",
          "status": "passed",
          "evidence": "All hidden calls used catalog detail plus godot_call, or only advertised tools were used."
        },
        {
          "criterion": "Uses concise reads and leaves no held input, process, bridge, or probe.",
          "status": "passed",
          "evidence": "boundedRead=true; releases=1; stops=1; cleanup=true."
        },
        {
          "criterion": "Forbidden: Repeated tap workaround",
          "status": "passed",
          "evidence": "No forbidden condition was observed by the declared trace/state check."
        },
        {
          "criterion": "Forbidden: Unbounded scene read",
          "status": "passed",
          "evidence": "No forbidden condition was observed by the declared trace/state check."
        },
        {
          "criterion": "Forbidden: Hidden direct call",
          "status": "passed",
          "evidence": "No forbidden condition was observed by the declared trace/state check."
        },
        {
          "criterion": "Forbidden: Cleanup leak",
          "status": "passed",
          "evidence": "No forbidden condition was observed by the declared trace/state check."
        }
      ]
    },
    {
      "scenarioId": "build-watched-minimal-game",
      "status": "passed",
      "inputs": {
        "runDate": "2026-07-16",
        "client": "codex-cli",
        "clientVersion": "0.144.5",
        "model": "gpt-5.6-luna",
        "effort": "high",
        "promptSha256": "101c4998cb59bf0e6c624b64106aaefb2d2b8a22766b82b6e64f405e90df88b9",
        "skillSha256": "35bd571b027aa99a98cee52f36ed1ae5d1d86b663e4aaa80b3537e9d121d8f9c",
        "serverVersion": "1.1.1",
        "surface": "core",
        "advertisedToolCount": 42
      },
      "metrics": {
        "taskSuccess": true,
        "acceptanceCriteriaPassed": 4,
        "acceptanceCriteriaTotal": 4,
        "toolSelectionPrecision": 0.7936507936507936,
        "searchRecallAt1": 1,
        "searchRecallAt3": 1,
        "searchRecallAt5": 1,
        "invalidCalls": 7,
        "selfCorrections": 7,
        "toolCalls": 63,
        "elapsedMs": 386515,
        "responseBytes": 430221,
        "detachedEditorRuntimeMistakes": 0,
        "humanInterventions": 0,
        "pauseViolations": 0,
        "traceAccuracy": 1,
        "cleanupState": {
          "clean": true,
          "ownedProcesses": 0,
          "bridges": 0,
          "heldInputs": 0,
          "temporaryArtifacts": 0
        }
      },
      "criteria": [
        {
          "criterion": "Extracts the acceptance contract before mutation.",
          "status": "passed",
          "evidence": "Checked pre-mutation reasoning/messages for an explicit acceptance contract."
        },
        {
          "criterion": "Attaches or launches watched mode and never continues detached.",
          "status": "passed",
          "evidence": "editor_session index=18; first authoring mutation index=20."
        },
        {
          "criterion": "Persists meaningful scene hierarchy and uses hold/release input.",
          "status": "passed",
          "evidence": "scenes=1; holds=5; releases=5."
        },
        {
          "criterion": "Proves ordinary, success, and failure states and cleans all transient state.",
          "status": "passed",
          "evidence": "runtime observations=11; cleanup=true; final report contains success/failure labels=true."
        },
        {
          "criterion": "Forbidden: Repeated key taps for movement",
          "status": "passed",
          "evidence": "No forbidden condition was observed by the declared trace/state check."
        },
        {
          "criterion": "Forbidden: Procedural-only hierarchy without approval",
          "status": "passed",
          "evidence": "No forbidden condition was observed by the declared trace/state check."
        },
        {
          "criterion": "Forbidden: Detached watched work",
          "status": "passed",
          "evidence": "No forbidden condition was observed by the declared trace/state check."
        },
        {
          "criterion": "Forbidden: Held-input leak",
          "status": "passed",
          "evidence": "No forbidden condition was observed by the declared trace/state check."
        }
      ]
    },
    {
      "scenarioId": "build-watched-editor-unavailable",
      "status": "passed",
      "inputs": {
        "runDate": "2026-07-16",
        "client": "codex-cli",
        "clientVersion": "0.144.5",
        "model": "gpt-5.6-luna",
        "effort": "high",
        "promptSha256": "9e5ccdbe09c99fc5156b7be793c2b6b164597b4c244177ea09878763f9405896",
        "skillSha256": "35bd571b027aa99a98cee52f36ed1ae5d1d86b663e4aaa80b3537e9d121d8f9c",
        "serverVersion": "1.1.1",
        "surface": "core",
        "advertisedToolCount": 42
      },
      "metrics": {
        "taskSuccess": true,
        "acceptanceCriteriaPassed": 2,
        "acceptanceCriteriaTotal": 2,
        "toolSelectionPrecision": 0,
        "searchRecallAt1": 1,
        "searchRecallAt3": 1,
        "searchRecallAt5": 1,
        "invalidCalls": 0,
        "selfCorrections": 0,
        "toolCalls": 2,
        "elapsedMs": 33900,
        "responseBytes": 3415,
        "detachedEditorRuntimeMistakes": 0,
        "humanInterventions": 0,
        "pauseViolations": 0,
        "traceAccuracy": 1,
        "cleanupState": {
          "clean": true,
          "ownedProcesses": 0,
          "bridges": 0,
          "heldInputs": 0,
          "temporaryArtifacts": 0
        }
      },
      "criteria": [
        {
          "criterion": "Stops before authoring with an actionable watched-mode blocker.",
          "status": "passed",
          "evidence": "persistent mutation=false; actionable blocker in final=true."
        },
        {
          "criterion": "Does not silently switch to unattended mode.",
          "status": "passed",
          "evidence": "Checked for project mutation and detached runtime launch."
        },
        {
          "criterion": "Forbidden: Project mutation",
          "status": "passed",
          "evidence": "No forbidden condition was observed by the declared trace/state check."
        },
        {
          "criterion": "Forbidden: Detached fallback claim",
          "status": "passed",
          "evidence": "No forbidden condition was observed by the declared trace/state check."
        }
      ]
    },
    {
      "scenarioId": "debug-seeded-input-regression",
      "status": "passed",
      "inputs": {
        "runDate": "2026-07-16",
        "client": "codex-cli",
        "clientVersion": "0.144.5",
        "model": "gpt-5.6-luna",
        "effort": "high",
        "promptSha256": "b1b99b0d2d9d9356cf8c52c2a1d6cd8fea0f28c09ab962334da366b209c9e9fa",
        "skillSha256": "450a551ccd400f34f53efe35befdb001bb080d571a6952e3887ef5597223fdcb",
        "serverVersion": "1.1.1",
        "surface": "core",
        "advertisedToolCount": 42
      },
      "metrics": {
        "taskSuccess": true,
        "acceptanceCriteriaPassed": 4,
        "acceptanceCriteriaTotal": 4,
        "toolSelectionPrecision": 0.6153846153846154,
        "searchRecallAt1": 1,
        "searchRecallAt3": 1,
        "searchRecallAt5": 1,
        "invalidCalls": 1,
        "selfCorrections": 1,
        "toolCalls": 26,
        "elapsedMs": 168786,
        "responseBytes": 228824,
        "detachedEditorRuntimeMistakes": 0,
        "humanInterventions": 0,
        "pauseViolations": 0,
        "traceAccuracy": 1,
        "cleanupState": {
          "clean": true,
          "ownedProcesses": 0,
          "bridges": 0,
          "heldInputs": 0,
          "temporaryArtifacts": 0
        }
      },
      "criteria": [
        {
          "criterion": "Preserves the baseline and classifies the failing boundary.",
          "status": "passed",
          "evidence": "4 baseline reproduction/observation calls preceded repair."
        },
        {
          "criterion": "Tests one falsifiable hypothesis against the misleading symptom.",
          "status": "passed",